{
  "schema_version": "utopia.workflow.v1",
  "id": "phase4_replay_workflow",
  "domain": "food",
  "label": "Phase 4 replay workflow",
  "steps": [
    {
      "id": "create_first_1",
      "tool": "create_record",
      "input": {
        "collection": "shopping_item",
        "title": "Phase 4 Replay Item A",
        "properties": {
          "source": "workflow-replay-probe",
          "quantity": "1"
        }
      }
    },
    {
      "id": "create_first_2",
      "tool": "create_record",
      "input": {
        "collection": "shopping_item",
        "title": "Phase 4 Replay Item B",
        "properties": {
          "source": "workflow-replay-probe",
          "quantity": "2"
        }
      }
    }
  ],
  "write_policy": "Reversible create actions only."
}
