{
  "schema_version": "utopia.workflow.v1",
  "id": "phase4_compensation_probe",
  "domain": "food",
  "label": "Phase 4 compensation probe",
  "steps": [
    {
      "id": "compensation_create",
      "tool": "create_record",
      "input": {
        "collection": "shopping_item",
        "title": "Phase 4 Compensation Item",
        "properties": {
          "source": "workflow-compensation-probe",
          "quantity": "1"
        }
      }
    },
    {
      "id": "compensation_update_missing",
      "tool": "update_record",
      "input": {
        "id": "phase4-missing-record",
        "collection": "shopping_item",
        "patch": {
          "title": "This step should fail"
        }
      }
    }
  ],
  "write_policy": "Reversible create/update with compensation on failure."
}
